,1,2,Organism,associated_phenotype
0,FBgn0003513,ENSG00000063438,dmelanogaster,"['abnormal neuroanatomy', 'abnormal neuroanatomy (with ss[D115.7])', 'abnormal neuroanatomy | somatic clone', 'antenna (with ss[aBR30-71])', 'chaeta (with ss[aBR30-71])', 'dendrite & dorsal multidendritic neuron ddaB | somatic clone', 'dendrite & dorsal multidendritic neuron ddaD | somatic clone', 'dendrite & dorsal multidendritic neuron ddaE', 'dendrite & dorsal multidendritic neuron ddaE (with ss[D115.7])', 'dendrite & dorsal multidendritic neuron ddaE | somatic clone', 'dendrite & dorsal multidendritic neuron ddaF | somatic clone', 'dendrite & lateral multidendritic neuron ldaB | somatic clone', 'leg | ectopic (with ss[aBR30-71])', 'lethal | recessive', 'visible (with ss[aBR30-71])', 'chaeta (with ss[aP88])', 'viable', 'visible (with ss[aP88])', 'antenna', 'visible | homeotic', 'posterior vertical bristle', 'scutellar bristle', 'vertical bristle', 'tarsal segment', 'arista (with Df(3R)ss-D114.4)', 'tarsal segment | ectopic (with Df(3R)ss-D114.4)', 'third segment of antenna (with Df(3R)ss-D114.4)', 'visible (with Df(3R)ss-D114.4)', 'antennal disc (with Df(3R)ss-D114.4)', 'fifth segment of antenna (with Df(3R)ss-D114.4)', 'fourth segment of antenna (with Df(3R)ss-D114.4)', 'leg joint (with ss[a])', 'leg | ectopic', 'metatarsus (with ss[a])', 'pretarsus (with ss[D115.7])', 'second segment of antenna (with Df(3R)ss-D114.4)', 'sex comb | ectopic (with ss[a])', 'tarsal segment 2 (with ss[D115.7])', 'tarsal segment 3 (with ss[D115.7])', 'tarsal segment 4 (with ss[D115.7])', 'ventral thoracic disc (with ss[D115.7])', 'visible', 'visible (with ss[D115.7])', 'abnormal neuroanatomy (with ss[134])', 'antennal sense organ', 'dendrite & dorsal multidendritic neuron ddaC | somatic clone', 'dendrite & dorsal multidendritic neuron ddaE (with ss[134])', 'dorsomedial papilla', 'leg', 'maxillary palpus', 'metatarsus', 'pale ommatidium | ectopic', 'pale ommatidium | ectopic | somatic clone', 'photoreceptor cell R7 of pale ommatidium | ectopic | somatic clone', 'photoreceptor cell R7 of yellow ommatidium | somatic clone', 'pretarsus (with ss[D114.9])', 'pretarsus | ectopic (with Df(3R)ss-D114.4)', 'tarsal segment (with Df(3R)ss-D114.4)', 'tarsal segment 2', 'tarsal segment 2 (with ss[D114.9])', 'tarsal segment 3', 'tarsal segment 3 (with ss[D114.9])', 'tarsal segment 4', 'tarsal segment 4 (with ss[D114.9])', 'unguis | ectopic (with Df(3R)ss-D114.4)', 'ventral thoracic disc (with ss[D114.9])', 'visible (with ss[D114.9])', 'yellow ommatidium', 'yellow ommatidium | somatic clone', 'trichogen cell, with Scer\\GAL4[pnr-MD237]', 'viable, with Dcr-2[UAS.cDa], Scer\\GAL4[elav.PLu]', 'viable, with Scer\\GAL4[Mef2.PR]', 'viable, with Scer\\GAL4[pnr-MD237]', 'viable, with Scer\\GAL4[tin.CΔ4]', 'abnormal gravitaxis', 'arista', 'abnormal neuroanatomy, with Scer\\GAL4[477]', 'abnormal neuroanatomy, with Scer\\GAL4[ppk.PG]', 'dendrite & dorsal multidendritic neuron ddaC, with Scer\\GAL4[ppk.PG]', 'dendrite & tracheal innervating neuron, with Scer\\GAL4[477]', 'denticle belt | medial, with Scer\\GAL4[69B]', 'eye photoreceptor cell | heat sensitive, with Scer\\GAL4[hs.PB]', 'eye photoreceptor cell, with Scer\\GAL4[GMR.PF]', 'eye photoreceptor cell, with Scer\\GAL4[GMR.long]', 'eye, with Scer\\GAL4[GMR.long]', 'femur | distal', 'increased cell death | cell autonomous | somatic clone, with Scer\\GAL4[Act5C.PI]', 'increased cell death | cell non-autonomous | somatic clone, with Scer\\GAL4[Act5C.PI]', 'leg anterior compartment', 'leg | distal, with Scer\\GAL4[ptc-559.1]', 'lethal | heat sensitive, with Scer\\GAL4[hs.PB]', 'maxillary palpus, with Scer\\GAL4[ptc-559.1]', 'ommatidium, with Scer\\GAL4[GMR.long]', 'photoreceptor cell R7 of pale ommatidium | heat sensitive, with Scer\\GAL4[hs.PB]', 'photoreceptor cell R7 of pale ommatidium, with Scer\\GAL4[GMR.PF]', 'photoreceptor cell R7 of pale ommatidium, with Scer\\GAL4[Pan-R7]', 'photoreceptor cell R7 of yellow ommatidium | ectopic | heat sensitive, with Scer\\GAL4[hs.PB]', 'photoreceptor cell R7 of yellow ommatidium | ectopic, with Scer\\GAL4[GMR.PF]', 'photoreceptor cell R7 of yellow ommatidium | ectopic, with Scer\\GAL4[Pan-R7]', 'rostral membrane, with Scer\\GAL4[ptc-559.1]', 'tergite, with Scer\\GAL4[ptc-559.1]', 'tibia, with Scer\\GAL4[ptc-559.1]', 'tracheal branch primordium, with Scer\\GAL4[69B]', 'wing disc | cell autonomous | somatic clone, with Scer\\GAL4[Act5C.PI]', 'wing margin, with Scer\\GAL4[NP7148]', 'wing, with Scer\\GAL4[ptc-559.1]', 'wing, with Scer\\GAL4[sd-SG29.1]', 'eye, with Scer\\GAL4[GMR.PU]', 'leg, with Scer\\GAL4[rn-GAL4]', 'tarsal segment, with Scer\\GAL4[rn-GAL4]', 'visible, with Scer\\GAL4[GMR.PU]', 'visible, with Scer\\GAL4[rn-GAL4]', 'abnormal courtship behavior', 'abnormal memory', 'flightless | recessive', 'mesothoracic tarsal segment | distal | ectopic', 'visible | homeotic | recessive', 'antennal segment', 'mesothoracic tarsal segment', 'metathoracic tarsal segment', 'prothoracic tarsal segment', 'female semi-sterile', 'male sterile', 'microchaeta', 'sex comb', 'unguis | ectopic', 'leg joint', 'partially lethal', 'sterile', 'antenna (with ss[134])', 'chaeta (with ss[134])', 'leg | ectopic (with ss[134])', 'visible (with ss[134])', 'arista | proximal', 'third segment of antenna | distal', 'arista | cold sensitive', 'fertile | recessive', 'viable | recessive', 'chaeta (with ss[1])', 'third segment of antenna', 'visible (with ss[1])', 'abnormal size', 'decreased occurrence of cell division', 'increased occurrence of cell division', 'mesothoracic leg disc | larval stage', 'metathoracic leg disc | larval stage', 'prothoracic leg disc | larval stage', 'fertile', 'thorax', 'abnormal behavior', 'antenna | distal | somatic clone', 'eye-antennal disc', 'leg joint (with ss[D114.9])', 'leg | ectopic | somatic clone', 'metatarsus (with ss[D114.9])', 'sex comb | ectopic (with ss[D114.9])', 'tarsal segment | ectopic', 'tarsal segment (with ss[sta])', 'visible (with ss[sta])', 'mesothoracic leg', 'abnormal visual perception', 'tarsal segment (with ss[abr])', 'visible (with ss[abr])', 'abnormal cell number | adult stage', 'abnormal neuroanatomy | adult stage', 'photoreceptor cell R8 of pale ommatidium', 'photoreceptor cell R8 of yellow ommatidium', 'bract', 'labial sensillum', 'labial sensillum | somatic clone', 'visible | somatic clone', 'abnormal neuroanatomy', 'abnormal neuroanatomy (with ss[D115.7])', 'abnormal neuroanatomy | somatic clone', 'antenna (with ss[aBR30-71])', 'chaeta (with ss[aBR30-71])', 'dendrite & dorsal multidendritic neuron ddaB | somatic clone', 'dendrite & dorsal multidendritic neuron ddaD | somatic clone', 'dendrite & dorsal multidendritic neuron ddaE', 'dendrite & dorsal multidendritic neuron ddaE (with ss[D115.7])', 'dendrite & dorsal multidendritic neuron ddaE | somatic clone', 'dendrite & dorsal multidendritic neuron ddaF | somatic clone', 'dendrite & lateral multidendritic neuron ldaB | somatic clone', 'leg | ectopic (with ss[aBR30-71])', 'lethal | recessive', 'visible (with ss[aBR30-71])', 'chaeta (with ss[aP88])', 'viable', 'visible (with ss[aP88])', 'antenna', 'visible | homeotic', 'posterior vertical bristle', 'scutellar bristle', 'vertical bristle', 'tarsal segment', 'arista (with Df(3R)ss-D114.4)', 'tarsal segment | ectopic (with Df(3R)ss-D114.4)', 'third segment of antenna (with Df(3R)ss-D114.4)', 'visible (with Df(3R)ss-D114.4)', 'antennal disc (with Df(3R)ss-D114.4)', 'fifth segment of antenna (with Df(3R)ss-D114.4)', 'fourth segment of antenna (with Df(3R)ss-D114.4)', 'leg joint (with ss[a])', 'leg | ectopic', 'metatarsus (with ss[a])', 'pretarsus (with ss[D115.7])', 'second segment of antenna (with Df(3R)ss-D114.4)', 'sex comb | ectopic (with ss[a])', 'tarsal segment 2 (with ss[D115.7])', 'tarsal segment 3 (with ss[D115.7])', 'tarsal segment 4 (with ss[D115.7])', 'ventral thoracic disc (with ss[D115.7])', 'visible', 'visible (with ss[D115.7])', 'abnormal neuroanatomy (with ss[134])', 'antennal sense organ', 'dendrite & dorsal multidendritic neuron ddaC | somatic clone', 'dendrite & dorsal multidendritic neuron ddaE (with ss[134])', 'dorsomedial papilla', 'leg', 'maxillary palpus', 'metatarsus', 'pale ommatidium | ectopic', 'pale ommatidium | ectopic | somatic clone', 'photoreceptor cell R7 of pale ommatidium | ectopic | somatic clone', 'photoreceptor cell R7 of yellow ommatidium | somatic clone', 'pretarsus (with ss[D114.9])', 'pretarsus | ectopic (with Df(3R)ss-D114.4)', 'tarsal segment (with Df(3R)ss-D114.4)', 'tarsal segment 2', 'tarsal segment 2 (with ss[D114.9])', 'tarsal segment 3', 'tarsal segment 3 (with ss[D114.9])', 'tarsal segment 4', 'tarsal segment 4 (with ss[D114.9])', 'unguis | ectopic (with Df(3R)ss-D114.4)', 'ventral thoracic disc (with ss[D114.9])', 'visible (with ss[D114.9])', 'yellow ommatidium', 'yellow ommatidium | somatic clone', 'trichogen cell, with Scer\\GAL4[pnr-MD237]', 'viable, with Dcr-2[UAS.cDa], Scer\\GAL4[elav.PLu]', 'viable, with Scer\\GAL4[Mef2.PR]', 'viable, with Scer\\GAL4[pnr-MD237]', 'viable, with Scer\\GAL4[tin.CΔ4]', 'abnormal gravitaxis', 'arista', 'abnormal neuroanatomy, with Scer\\GAL4[477]', 'abnormal neuroanatomy, with Scer\\GAL4[ppk.PG]', 'dendrite & dorsal multidendritic neuron ddaC, with Scer\\GAL4[ppk.PG]', 'dendrite & tracheal innervating neuron, with Scer\\GAL4[477]', 'denticle belt | medial, with Scer\\GAL4[69B]', 'eye photoreceptor cell | heat sensitive, with Scer\\GAL4[hs.PB]', 'eye photoreceptor cell, with Scer\\GAL4[GMR.PF]', 'eye photoreceptor cell, with Scer\\GAL4[GMR.long]', 'eye, with Scer\\GAL4[GMR.long]', 'femur | distal', 'increased cell death | cell autonomous | somatic clone, with Scer\\GAL4[Act5C.PI]', 'increased cell death | cell non-autonomous | somatic clone, with Scer\\GAL4[Act5C.PI]', 'leg anterior compartment', 'leg | distal, with Scer\\GAL4[ptc-559.1]', 'lethal | heat sensitive, with Scer\\GAL4[hs.PB]', 'maxillary palpus, with Scer\\GAL4[ptc-559.1]', 'ommatidium, with Scer\\GAL4[GMR.long]', 'photoreceptor cell R7 of pale ommatidium | heat sensitive, with Scer\\GAL4[hs.PB]', 'photoreceptor cell R7 of pale ommatidium, with Scer\\GAL4[GMR.PF]', 'photoreceptor cell R7 of pale ommatidium, with Scer\\GAL4[Pan-R7]', 'photoreceptor cell R7 of yellow ommatidium | ectopic | heat sensitive, with Scer\\GAL4[hs.PB]', 'photoreceptor cell R7 of yellow ommatidium | ectopic, with Scer\\GAL4[GMR.PF]', 'photoreceptor cell R7 of yellow ommatidium | ectopic, with Scer\\GAL4[Pan-R7]', 'rostral membrane, with Scer\\GAL4[ptc-559.1]', 'tergite, with Scer\\GAL4[ptc-559.1]', 'tibia, with Scer\\GAL4[ptc-559.1]', 'tracheal branch primordium, with Scer\\GAL4[69B]', 'wing disc | cell autonomous | somatic clone, with Scer\\GAL4[Act5C.PI]', 'wing margin, with Scer\\GAL4[NP7148]', 'wing, with Scer\\GAL4[ptc-559.1]', 'wing, with Scer\\GAL4[sd-SG29.1]', 'eye, with Scer\\GAL4[GMR.PU]', 'leg, with Scer\\GAL4[rn-GAL4]', 'tarsal segment, with Scer\\GAL4[rn-GAL4]', 'visible, with Scer\\GAL4[GMR.PU]', 'visible, with Scer\\GAL4[rn-GAL4]', 'abnormal courtship behavior', 'abnormal memory', 'flightless | recessive', 'mesothoracic tarsal segment | distal | ectopic', 'visible | homeotic | recessive', 'antennal segment', 'mesothoracic tarsal segment', 'metathoracic tarsal segment', 'prothoracic tarsal segment', 'female semi-sterile', 'male sterile', 'microchaeta', 'sex comb', 'unguis | ectopic', 'leg joint', 'partially lethal', 'sterile', 'antenna (with ss[134])', 'chaeta (with ss[134])', 'leg | ectopic (with ss[134])', 'visible (with ss[134])', 'arista | proximal', 'third segment of antenna | distal', 'arista | cold sensitive', 'fertile | recessive', 'viable | recessive', 'chaeta (with ss[1])', 'third segment of antenna', 'visible (with ss[1])', 'abnormal size', 'decreased occurrence of cell division', 'increased occurrence of cell division', 'mesothoracic leg disc | larval stage', 'metathoracic leg disc | larval stage', 'prothoracic leg disc | larval stage', 'fertile', 'thorax', 'abnormal behavior', 'antenna | distal | somatic clone', 'eye-antennal disc', 'leg joint (with ss[D114.9])', 'leg | ectopic | somatic clone', 'metatarsus (with ss[D114.9])', 'sex comb | ectopic (with ss[D114.9])', 'tarsal segment | ectopic', 'tarsal segment (with ss[sta])', 'visible (with ss[sta])', 'mesothoracic leg', 'abnormal visual perception', 'tarsal segment (with ss[abr])', 'visible (with ss[abr])', 'abnormal cell number | adult stage', 'abnormal neuroanatomy | adult stage', 'photoreceptor cell R8 of pale ommatidium', 'photoreceptor cell R8 of yellow ommatidium', 'bract', 'labial sensillum', 'labial sensillum | somatic clone', 'visible | somatic clone']"
1,FBgn0001233,ENSG00000096384,dmelanogaster,"['wild-type', 'GO0016006:Nebenkern', 'Nebenkern derivative', 'abnormal behavior', 'abnormal locomotor rhythm', 'abnormal locomotor rhythm (with Hsp83[e6A])', 'abnormal locomotor rhythm (with Hsp83[e6D])', 'abnormal locomotor rhythm (with Hsp83[j5C2])', 'embryonic abdominal segment | maternal effect (with Hsp83[e6D])', 'female fertile', 'female semi-fertile', 'male sterile', 'primary spermatocyte', 'primary spermatocyte cyst', 'spermatid', 'spermatid axoneme', 'spermatocyte', 'spermatozoon', 'viable', 'abnormal cell polarity (with Hsp83[P582])', 'lethal - all die before end of larval stage | recessive', 'lethal | recessive', 'neuroblast (with Hsp83[P582])', 'partially lethal (with Hsp83[6-55])', 'viable (with Hsp83[e1D])', 'viable (with Hsp83[e3A])', 'dorsal appendage (with Hsp83[e6A])', 'egg (with Hsp83[e6A])', 'egg chamber (with Hsp83[e6A])', 'nurse cell (with Hsp83[e6A])', 'eye disc | somatic clone | third instar larval stage', 'increased occurrence of cell division | pupal stage | somatic clone', 'increased occurrence of cell division | somatic clone | third instar larval stage', 'lethal (with Hsp83[P582])', 'lethal (with Hsp83[j5C2])', 'lethal - all die before end of pupal stage', 'male sterile (with Hsp83[e1D])', 'male sterile (with Hsp83[e3A])', 'male sterile (with Hsp83[e4A])', 'male sterile (with Hsp83[e6A])', 'male sterile (with Hsp83[e6D])', 'partially lethal (with Hsp83[13F3])', 'partially lethal (with Hsp83[19F2])', 'GO0005813:centrosome', 'GO0072686:mitotic spindle | larval stage', 'abnormal mitotic cell cycle | larval stage', 'anterior dorsocentral bristle', 'embryonic/larval brain | larval stage', 'humeral bristle', 'mesothoracic bristle | increased number', 'metathoracic bristle | increased number', 'posterior dorsocentral bristle', 'scutellar bristle | increased number', 'viable (with Hsp83[e6A])', 'viable (with Hsp83[e6D])', 'fertile', 'GO0030017:sarcomere, with Scer\\GAL4[Mef2.PR]', 'GO0030018:Z disc, with Scer\\GAL4[Mef2.PR]', 'embryonic/larval somatic muscle, with Scer\\GAL4[Mef2.PR]', 'lethal | male, with Scer\\GAL4[Bx-MS1096]', 'lethal, with Scer\\GAL4[Act5C.PU]', 'lethal, with Scer\\GAL4[GMR.PF], Scer\\GAL4[ey.PH]', 'partially lethal - majority die | female, with Scer\\GAL4[Bx-MS1096]', 'partially lethal, with Scer\\GAL4[tin.CΔ4]', 'some die during pupal stage, with Scer\\GAL4[tin.CΔ4]', 'visible, with Scer\\GAL4[Bx-MS1096]', 'wing, with Scer\\GAL4[Bx-MS1096]', 'photoreceptor cell R7', 'secondary pigment cell', 'increased cell death | third instar larval stage, with Scer\\GAL4[en-e16E]', 'viable, with Scer\\GAL4[da.G32]', 'wing disc | third instar larval stage, with Scer\\GAL4[en-e16E]', 'abnormal developmental rate | larval stage, with Scer\\GAL4[da.G32]', 'lethal - all die during third instar larval stage, with Scer\\GAL4[da.G32]', 'GO0048786:presynaptic active zone | decreased number | third instar larval stage, with Scer\\GAL4[Toll-6-D42]', 'embryonic/larval neuromuscular junction | third instar larval stage, with Scer\\GAL4[Toll-6-D42]', 'eye, with Scer\\GAL4[GMR.PU]', 'increased occurrence of cell division | pupal stage, with Scer\\GAL4[GMR.PU]', 'increased occurrence of cell division | pupal stage, with Scer\\GAL4[ap-md544]', 'wing | dorsal, with Scer\\GAL4[ap-md544]', 'abnormal cell polarity (with Hsp83[13F3])', 'lethal (with Hsp83[6-55])', 'neuroblast (with Hsp83[13F3])', 'female semi-sterile', 'short lived', 'chaeta', 'male sterile (with Hsp83[6-55])', 'viable (with Hsp83[13F3])', 'viable (with Hsp83[19F2])', 'viable (with Hsp83[9J1])', 'abnormal locomotor rhythm (with Hsp83[08445])', 'dorsal appendage (with Hsp83[19F2])', 'egg (with Hsp83[19F2])', 'egg chamber (with Hsp83[19F2])', 'nurse cell (with Hsp83[19F2])', 'embryonic abdominal segment | maternal effect (with Hsp83[08445])']"
